standard_id,title,short_citation,region,applies_to,notes
ISO_7198,Cardiovascular implants and extracorporeal systems — Vascular prostheses — Tubular vascular grafts and vascular patches,ISO 7198:2016,Global,Vascular Grafts;Stent-Grafts;Cardiovascular,"Requirements for materials, construction, and mechanical testing of vascular implants."
ISO_10993-3,"Biological evaluation of medical devices — Part 3: Tests for genotoxicity, carcinogenicity and reproductive toxicity",ISO 10993-3:2014,Global,Biocompatibility;All;Laboratory,Long-term safety testing requirements for chronic patient-contact materials.
ISO_10993-6,Biological evaluation of medical devices — Part 6: Tests for local effects after implantation,ISO 10993-6:2016,Global,Biocompatibility;Implants;Laboratory,Evaluation of tissue response at the site of implant placement.
ISO_10993-9,Biological evaluation of medical devices — Part 9: Framework for identification and quantification of potential degradation products,ISO 10993-9:2019,Global,Biocompatibility;All;Laboratory,Methodology for identifying what products are released as a device degrades.
ISO_10993-11,Biological evaluation of medical devices — Part 11: Tests for systemic toxicity,ISO 10993-11:2017,Global,Biocompatibility;All;Laboratory,Evaluation of potential generalized effects on organs away from the site of contact.
ISO_10993-13,Biological evaluation of medical devices — Part 13: Identification and quantification of degradation products from polymeric medical devices,ISO 10993-13:2010,Global,Biocompatibility;Materials;Analytical Lab,Specific procedures for thermal and chemical degradation of plastics.
ISO_10993-14,Biological evaluation of medical devices — Part 14: Identification and quantification of degradation products from ceramics,ISO 10993-14:2001,Global,Biocompatibility;Materials;Analytical Lab,Specific procedures for degradation of ceramic and glass-based materials.
ISO_10993-15,Biological evaluation of medical devices — Part 15: Identification and quantification of degradation products from metals and alloys,ISO 10993-15:2019,Global,Biocompatibility;Materials;Analytical Lab,Evaluation of metal ion release and corrosion products from metallic implants.
IEC_60601-2-33,Medical electrical equipment — Part 2-33: Particular requirements for magnetic resonance safety,IEC 60601-2-33:2022,Global,MRI Scanners;Radiology,Critical for validating RF heating and magnetic safety limits.
IEC_60601-2-37,Medical electrical equipment — Part 2-37: Particular requirements for ultrasound safety,IEC 60601-2-37:2024,Global,Ultrasound;Diagnostic;Lab,Safety/performance for diagnostic/monitoring equipment.
IEC_60601-2-43,Medical electrical equipment — Part 2-43: Particular requirements for interventional X-ray,IEC 60601-2-43:2022,Global,Cardiac Cath Labs;Imaging,Crucial for OQ of motorized arms and imaging detector field sizes.
IEC_60601-2-45,Medical electrical equipment — Part 2-45: Particular requirements for mammographic X-ray,IEC 60601-2-45:2022,Global,Mammography;X-Ray Systems,Specific safety for full-field digital mammography.
IEC_60601-2-54,Medical electrical equipment — Part 2-54: Particular requirements for radiography/radioscopy,IEC 60601-2-54:2022,Global,X-Ray Systems;Radiology,"Safety for stationary, mobile, and tomographic X-ray."
ISO_14698-1,Cleanrooms — Biocontamination control — Part 1: General principles,ISO 14698-1:2003,Global,Facilities;Cleanrooms;Micro,Methodology for evaluating biocontamination in controlled environments. 
ISO_14698-2,Cleanrooms — Biocontamination control — Part 2: Evaluation of data,ISO 14698-2:2003,Global,Facilities;Cleanrooms;Micro,Guidance for interpreting results from biocontamination sampling. 
ISO_11138-1,Sterilization — Biological indicators — Part 1: General requirements,ISO 11138-1:2017,Global,Sterilization;Challenge;BI,Production and labeling for all biological indicators. 
ISO_11138-2,Sterilization — Biological indicators — Part 2: Indicators for EtO,ISO 11138-2:2017,Global,Sterilization;EtO Chambers,Specific indicators for ethylene oxide gas processes. 
ISO_11138-3,Sterilization — Biological indicators — Part 3: Indicators for moist heat,ISO 11138-3:2017,Global,Sterilization;Autoclaves,Specific indicators for steam/moist heat processes. 
ISO_11138-7,Sterilization — Biological indicators — Part 7: Guidance for use,ISO 11138-7:2019,Global,Sterilization;Validation;BI,Selection and interpretation of results in cycle development. 
ISO_18472,Sterilization — Biological and chemical indicators — Test equipment,ISO 18472:2018,Global,Sterilization;Metrology,"Requirements for ""resistometers"" used to test indicators. "
IEC_60601-1-8,Medical electrical equipment — Part 1-8: Alarm systems,IEC 60601-1-8:2020,Global,All Active Devices;Alarms,Requirements for audible and visual medical alarm patterns.
IEC_60601-1-11,Medical electrical equipment — Part 1-11: Home healthcare,IEC 60601-1-11:2020,Global,Home Devices;Glucometers,Requirements for devices used by laypersons in home settings.
IEC_60601-1-12,Medical electrical equipment — Part 1-12: EMS environment,IEC 60601-1-12:2020,Global,EMS;Defibrillators;Transport,Requirements for devices used in ambulances and field triage.
ASTM_E3270,Standard Guide for Operational Qualification of Gamma Irradiators,ASTM E3270-21,US,Sterilization;Gamma;E-Beam,FDA-recognized pathway for OQ of radiation systems. 
AAMI_TIR17,Compatibility of materials subjected to sterilization,AAMI TIR17:2024,US,All;Sterilization;Design,Assessment of how sterilization (EtO/Gamma) impacts materials. 
AAMI_ST72,Bacterial endotoxins — Test methods and routine monitoring,AAMI ST72:2019,US,Sterilization;LAL;Laboratory,Standards for pyrogenicity testing and batch-testing alternatives.
AAMI_ST91,Flexible and semi-rigid endoscope processing in health care,AAMI ST91:2021,US,Cleaning;Endoscopes;Reprocessing,Comprehensive guide for HLD and sterilization of endoscopes.
AAMI_ST108,Water for the processing of medical devices,AAMI ST108:2023,US,Utilities;Cleaning;Reprocessing,Defines water quality (PW/WFI) for device cleaning/rinsing.
ISO_11979-1,Ophthalmic implants — Intraocular lenses — Part 1: Vocabulary,ISO 11979-1:2018,Global,IOLs;Ophthalmics,Foundational terminology for intraocular lens evaluation.
ISO_11979-4,Ophthalmic implants — Intraocular lenses — Part 4: Labelling and information,ISO 11979-4:2008,Global,IOLs;Ophthalmics;Labeling,Specific requirements for IOL primary and secondary packaging data.
ISO_11979-9,Ophthalmic implants — Intraocular lenses — Part 9: Multifocal intraocular lenses,ISO 11979-9:2006,Global,MIOLs;Ophthalmics;Metrology,Particular requirements for lenses with multi-distance optical powers.
ISO_11979-10,Ophthalmic implants — Intraocular lenses — Part 10: Phakic IOLs,ISO 11979-10:2018,Global,PIOLs;Ophthalmics;Clinical,Requirements for clinical investigation of corrections in phakic eyes.
ISO_25539-1,Cardiovascular implants — Endovascular devices — Part 1: Endovascular prostheses,ISO 25539-1:2017,Global,Stent-grafts;Aortic Grafts,Core requirements for aortic and peripheral graft systems.
ISO_25539-2,Cardiovascular implants — Endovascular devices — Part 2: Vascular stents,ISO 25539-2:2020,Global,Stents;Nitinol;Cardiovascular,Specific benchmarks for bare metal and drug-eluting vascular stents.
ISO_25539-3,Cardiovascular implants — Endovascular devices — Part 3: Vena cava filters,ISO 25539-3:2011,Global,VC Filters;Embolic Protection,Benchmarks for implantable filters used to prevent pulmonary embolism.
ISO_10555-3,Intravascular catheters — Part 3: Central venous catheters,ISO 10555-3:2013,Global,CVCs;Catheters;PICC Lines,Particular requirements for long-term venous access devices.
ASTM_F2394,Standard Guide for Measuring Securement of a Stent on a Balloon,ASTM F2394-07,US,Stents;Balloon Catheters;Assembly,Industry-standard protocol for qualifying stent crimping/retention.
ASTM_F2081,Standard Guide for Characterization and Presentation of the Dimensional Attributes of Stents,ASTM F2081-06,US,Stents;Metrology;Metrology,"Methodology for measuring stent diameter, length, and wall thickness."
ASTM_F2606,Standard Guide for Three-Point Bending of Balloon-Expandable Vascular Stents,ASTM F2606-08,US,Stents;Mechanical Testing,Measures the flexural rigidity of the stent/delivery system.
ASTM_F2942,"Standard Guide for In vitro Axial, Bending, and Torsional Durability Testing",ASTM F2942-19,US,Vascular Stents;Fatigue Rigs,Provides protocols for accelerated long-term durability testing.
ISO_15609-4,Specification and qualification of welding procedures for metallic materials — Part 4: Laser beam welding,ISO 15609-4:2009,Global,Laser Welders;Active Implants;Assembly,Standardizes WPS for medical laser joining processes.
ISO_13919-1,"Welding — Electron and laser-beam welded joints — Part 1: Steel, nickel, and titanium",ISO 13919-1:2019,Global,Laser Welders;Surgical Tools;Implants,Defines permissible imperfection levels for high-quality welds.
ANSI_Z136.1,American National Standard for Safe Use of Lasers,ANSI Z136.1-2022,US,Lasers;Welding;Production Safety,Critical for qualifying laser enclosures and administrative controls.
ASTM_F2182,Standard Test Method for Measurement of RF Induced Heating on or near Passive Implants,ASTM F2182-19,US,Passive Implants;MRI;Metrology,Procedure for qualifying temperature rise during MRI exposure.
ISO_TS_10974,Assessment of the safety of MRI for patients with an active implantable medical device,ISO/TS 10974:2018,Global,Active Implants;MRI;Safety Testing,Four-tiered approach for validating active device safety in MRI.
ISO_21530,Dentistry — Oral healthcare products — Evaluation of resistance to chemical disinfectants,ISO 21530:2004,Global,Dental Equipment;Cleaning;Metrology,Standard for validating surface resistance to repetitive cleaning.
ISO_27185,Cardiac rhythm management devices — Symbols to be used with labels,ISO 27185:2012,Global,Pacemakers;Labeling,Specific symbols for implantable cardiac rhythm devices.
ISO_11040-4,Prefilled syringes — Part 4: Glass barrels for injectables,ISO 11040-4:2015,Global,Syringes;Filling;Packaging,Requirements for the primary container components of injectables.
USP_87,"Biological Reactivity Test, In Vitro — Direct Contact Test",USP ,US,Biocompatibility;All;Laboratory,Evaluates cellular reactivity of materials via elution and agar overlay. 
USP_88,"Biological Reactivity Test, In Vivo — Plastic Class VI Testing",USP ,US,Biocompatibility;Implants;Materials,Determines systemic and local responses to plastics and polymers. 
USP_788,Particulate Matter in Injections — Sub-visible Particulates,USP ,US,IVD Production;Filling;HCT/Ps,Methods for counting particulates in injectables and sterile liquids.
USP_643,Total Organic Carbon (TOC) — Water Monitoring,USP ,US,Utilities;WFI Systems;Pure Water,Specifies the testing methodology and limits for organic impurities.
USP_645,Water Conductivity — Sanitary Monitoring,USP ,US,Utilities;WFI Systems;Pure Water,Three-stage test for determining the ionic purity of process water. 
ASTM_F1904,Standard Practice for Testing the Biological Responses to Particles In Vivo,ASTM F1904-14,US,Biocompatibility;Implants;Metrology,Evaluates tissue reaction to wear debris from joint replacements. 
ASTM_F1147,Standard Test Method for Tension Testing of Calcium Phosphate and Metallic Coatings,ASTM F1147-05,US,Orthopedics;HA Sprayers;Coating,Mandatory protocol for qualifying implant coating adhesion strength. 
ASTM_F1044,Standard Test Method for Shear Testing of Porous Metal Coatings,ASTM F1044-05,US,Orthopedics;HA Sprayers;Sintering,Measures the static shear resistance of surface/substrate interfaces. 
ASTM_F1160,Shear and Bending Fatigue Testing of Calcium Phosphate and Metallic Coatings,ASTM F1160-14,US,Orthopedics;Fatigue Rigs;Metrology,Constant stress amplitude testing to determine coating durability.
ISO_10555-1,Intravascular catheters — Sterile and single-use catheters — Part 1: General requirements,ISO 10555-1:2013,Global,Catheters;Interventional;Forming,"Requirements for radio-detectability, tensile force, and leakage."
ISO_10555-4,Intravascular catheters — Part 4: Balloon dilatation catheters,ISO 10555-4:2023,Global,PTCA Balloons;Catheters;Assembly,Benchmarks for rated burst pressure (RBP) and deflation time.
ISO_10555-5,Intravascular catheters — Part 5: Over-needle peripheral catheters,ISO 10555-5:2024,Global,Cannulas;Needles;Peripheral Access,Specific safety for over-the-needle vascular access assemblies.
ISO_5838-1,Implants for surgery — Metallic skeletal pins and wires — Part 1: General requirements,ISO 5838-1:2013,Global,Skeletal Pins;Orthopedic;Machining,Dimensional and material benchmarks for metallic bone fasteners.
ISO_14630,Non-active surgical implants — General requirements,ISO 14630:2012,Global,All Implants;Orthopedic;Vascular,"Core requirements for marking, packaging, and biocompatibility."
ASTM_F138,Wrought 18Chromium-14Nickel-2.5Molybdenum Stainless Steel,ASTM F138-23,US,Orthopedics;Implants;Material Prep,Standard chemistry for 316LVM implant-grade stainless steel.
ASTM_F75,Cobalt-28 Chromium-6 Molybdenum Alloy Castings,ASTM F75-23,US,Orthopedics;Furnaces;Casting,Specification for Co-Cr-Mo alloys used in joint bearing surfaces.
ASTM_F1537,Wrought Cobalt-28Chromium-6Molybdenum Alloys,ASTM F1537-20,US,Orthopedics;Machining;Material Prep,Requirements for bar and wire forms used in precision screw making.
IEC_62353,Medical electrical equipment — Recurrent test and test after repair,IEC 62353:2014,Global,Active Devices;Metrology;Repair,Protocols for periodic safety testing and ground bond verification.
ISO_22441,Sterilization of health care products — VH2O2 — Requirements,ISO 22441:2022,Global,Sterilization;VHP Units;Isolators,Requirements for vaporized hydrogen peroxide (VH2O2) processes.
ASTM_D4169,Standard Practice for Performance Testing of Shipping Containers,ASTM D4169-23,US,Packaging;Logistics;PQ Studies,"Mandatory simulation of drops, vibration, and altitude for sterile kits."
ISO_10993-10,Biological evaluation of medical devices — Part 10: Tests for skin sensitization,ISO 10993-10:2021,Global,Biocompatibility;All;Laboratory,Evaluates potential for delayed hypersensitivity reactions.
ISO_10993-23,Biological evaluation of medical devices — Part 23: Tests for irritation,ISO 10993-23:2021,Global,Biocompatibility;All;Laboratory,Specific requirements for irritation testing (replaces part of -10).
ISO_11138-8,Sterilization — Biological indicators — Part 8: Method for validation of a reduced incubation time,ISO 11138-8:2021,Global,Sterilization;Validation;BIs,Protocol for shortening the wait-time for biological indicator results.
ISO_13408-2,Aseptic processing of health care products — Part 2: Sterilizing filtration,ISO 13408-2:2018,Global,Aseptic Filling;IVDs;Vial Fillers,Requirements for qualifying filters in liquid/gas sterilizing paths.
ISO_14161,"Sterilization — Biological indicators — Guidance for selection, use and interpretation of results",ISO 14161:2009,Global,Sterilization;Challenge;BIs,Technical guidance for BI application in cycle development.
ASTM_F2101,Standard Test Method for Evaluating the Bacterial Filtration Efficiency (BFE) of Medical Face Mask Materials,ASTM F2101-25,US,PPE;Masks;Laundering,Standard test using Staphylococcus aureus biological aerosols.
ASTM_F1670,Resistance of Materials Used in Protective Clothing to Penetration by Synthetic Blood,ASTM F1670-24a,US,PPE;Gowns;Cleanroom Suits,Qualifying test for barrier effectiveness against blood-borne pathogens.
ISO_7886-2,Sterile hypodermic syringes for single use — Part 2: Syringes for use with power-driven syringe pumps,ISO 7886-2:2020,Global,Syringes;Infusion Pumps;Filling,Safety/performance requirements for automated drug delivery.
ISO_1135-4,"Transfusion equipment for medical use — Part 4: Transfusion sets for single use, gravity feed",ISO 1135-4:2025,Global,Transfusion Kits;IVD;HCT/Ps,Standards for gravity-based blood and fluid delivery systems.
ASTM_F2407,Standard Specification for Surgical Gowns Intended for Use in Healthcare Facilities,ASTM F2407-23a,US,PPE;Surgical Gowns;Laundering,Defines performance levels for surgical gowns based on AAMI PB70.
ASTM_F3502,Standard Specification for Barrier Face Coverings,ASTM F3502-25,US,PPE;Masks;Environment,Requirements for non-medical masks used in public or facility settings.
ASTM_F3107,Measuring Accuracy after Mechanical Disturbances on Reference Frames of Computer Assisted Surgery Systems,ASTM F3107-14,US,Surgical Robots;Metrology,OQ test method for validating robotic surgical navigation precision.
ASTM_F3292,Standard Practice for Inspection of Spinal Implants Undergoing Testing,ASTM F3292-25,US,Orthopedics;Spinal Implants;Fatigue,Procedures for identifying cracks/wear during dynamic test cycles.
ISO_14243-3,Wear of total knee-joint prostheses — Part 3: Loading/displacement parameters for displacement control,ISO 14243-3:2014,Global,Knee Implants;Mechanical Testing,Defines the gait cycle simulation for displacement-controlled rigs.
ASTM_F3690,Standard Test Method for Evaluating Suture Anchor Insertion and Pull Displacement Resistance,ASTM F3690-24,US,Orthopedics;Suture Anchors;Metrology,PQ benchmark for validating anchor retention strength in bone.
ASTM_F732,Standard Test Method for Wear Testing of Polymeric Materials Used in Total Joint Prostheses,ASTM F732-17,US,Orthopedics;Implants;Material Lab,Evaluates long-term material wear debris (PEEK/UHMWPE).
ASTM_F2789,Standard Guide for Mechanical and Functional Characterization of Nucleus Devices,ASTM F2789-10,US,Spinal Implants;Mechanical Testing,Specialized protocols for intervertebral disc replacement devices.
ASTM_F3140,Cyclic Fatigue Testing of Metal Tibial Tray Components of Unicondylar Knee Joint Replacements,ASTM F3140-23,US,Orthopedics;Knee Implants;Fatigue,Particular requirements for partial knee replacement durability.
ISO_21536,Non-active surgical implants — Joint replacement implants — Specific requirements for knee-joint replacements,ISO 21536:2023,Global,Knee Implants;Orthopedics;Design,Core performance and safety benchmarks for all total knee systems.
ISO_11491,Implants for surgery — Determination of impact resistance of ceramic femoral heads,ISO 11491:2017,Global,Orthopedics;Hip Implants;Metrology,"Validation test for surviving surgical ""miss-hit"" impact events."
IEC_60601-2-24,Medical electrical equipment — Part 2-24: Particular requirements for basic safety of infusion pumps,IEC 60601-2-24:2012,Global,Infusion Pumps;Therapeutic,Critical for validating flow accuracy and occlusion pressure alarms.
ISO_14801,Dentistry — Implants — Dynamic loading test for endosseous dental implants,ISO 14801:2016,Global,Dental Implants;Metrology;Fatigue,Defines the flexural fatigue rig protocol for worst-case dental implants. 
USP_1229_5,Biological Indicators for Sterilization,USP <1229.5>,US,Sterilization;Validation;BIs,Detailed performance requirements for BIs used in life science labs.
USP_55,Biological Indicators — Resistance Performance Tests,USP ,US,Sterilization;Metrology;BIs,Standard methods for determining BI D-values and survival/kill times.
USP_1225,Validation of Compendial Procedures,USP ,US,Analytical Lab;Metrology,Requirements for proving analytical methods are accurate and precise.
ASTM_E2857,Standard Guide for Validating Analytical Methods,ASTM E2857-11,US,Analytical Lab;Metrology,Complementary guidance for validating non-compendial laboratory tests.
USP_61,Microbiological Examination of Nonsterile Products: Microbial Enumeration Tests,USP ,US,IVD Production;Reagents;Micro,Standard for assessing bioburden levels in non-sterile device components. 
USP_62,Microbiological Examination of Nonsterile Products: Tests for Specified Microorganisms,USP ,US,IVD Production;Reagents;Micro,Procedures for identifying pathogens like S. aureus or P. aeruginosa. 
ISO_11608-1,Needle-based injection systems for medical use — Part 1: General requirements,ISO 11608-1:2022,Global,Pen Injectors;Autoinjectors,Core requirements for automated drug delivery hardware.
ISO_11608-6,Needle-based injection systems for medical use — Part 6: On-body delivery systems,ISO 11608-6:2022,Global,Wearable Pumps;Infusion,Particular requirements for bolus injectors attached to the patient.
ISO_11608-7,Needle-based injection systems for medical use — Part 7: Accessibility for persons with visual impairment,ISO 11608-7:2016,Global,Pen Injectors;Labeling;Home Use,Standards for tactile/audible feedback validation in home devices.
ASTM_D3577,Standard Specification for Rubber Surgical Gloves,ASTM D3577-19,US,PPE;Gloves;Forming,Establishes the material and sterile integrity benchmarks for surgeons.
ASTM_D3578,Standard Specification for Rubber Examination Gloves,ASTM D3578-19,US,PPE;Gloves;Laundering,Particular requirements for non-sterile patient contact gloves.
ASTM_D5250,Standard Specification for Poly(vinyl chloride) Gloves for Medical Application,ASTM D5250-19,US,PPE;Gloves;Material Prep,Requirements for PVC/vinyl gloves used in low-risk healthcare.
ASTM_D6319,Standard Specification for Nitrile Examination Gloves for Medical Application,ASTM D6319-19,US,PPE;Gloves;Forming,Performance benchmarks for high-durability synthetic gloves.
AAMI_TIR101,Fluid Delivery Performance Testing for Infusion Pumps,AAMI TIR101:2021,US,Infusion Pumps;Metrology,Recommended framework for validating delivery accuracy below 1 mL/h.
ISO_11138-8,Sterilization — BIs — Part 8: Validation of a reduced incubation time,ISO 11138-8:2021,Global,Sterilization;Validation,Protocol for justifying 24-hour vs 7-day biological indicator results. 
ASTM_F2502,Specification and Test Methods for Absorbable Plates and Screws,ASTM F2502-17,US,Orthopedics;Bio-absorbables,Governs the degradation and mechanical testing of resorbable fixations. 
ISO_14879-1,Implants for surgery — Knee-joint prostheses — Part 1: Tibial trays,ISO 14879-1:2020,Global,Orthopedics;Knee Implants,Specific requirements for the endurance properties of tibial bases. 
ISO_22622,Health informatics — Audit trails for electronic health records,ISO 22622:2019,Global,IT Systems;LIMS;Radiology,Controls for recording all changes to sensitive clinical data sets. 
ISO_13408-1,Aseptic processing of health care products — Part 1: General requirements,ISO 13408-1:2023,Global,Aseptic Filling;Isolators;Vial Fillers,Foundational requirements for aseptic manufacturing environments.
ISO_13408-4,Aseptic processing of health care products — Part 4: Clean-in-place technologies,ISO 13408-4:2005,Global,Cleaning;CIP Skids;Vessels,Requirements for qualifying automated cleaning of fluid paths.
ISO_13408-5,Aseptic processing of health care products — Part 5: Sterilization in place,ISO 13408-5:2006,Global,Sterilization;SIP Systems;Vessels,Validation of in-situ steam sterilization for complex equipment.
ISO_14937,Sterilization of health care products — General requirements for characterization of a sterilizing agent,ISO 14937:2009,Global,Sterilization;VHP;Ozone;Liquid,Used for non-traditional agents like VHP or low-temp plasma. 
ISO_8600-1,Endoscopes — Medical endoscopes and endotherapy devices — Part 1: General requirements,ISO 8600-1:2015,Global,Endoscopes;Surgical Instruments,Core requirements for visualization devices and fiber optics.
ISO_8637,"Cardiovascular implants and extracorporeal systems — Haemodialyzers, haemodiafilters, haemofilters",ISO 8637:2010,Global,Dialysis Filters;Metrology;Assembly,Performance requirements for artificial kidney filters.
ISO_80601-2-13,Medical electrical equipment — Part 2-13: Particular requirements for anesthesia systems,ISO 80601-2-13:2022,Global,Anesthesia Machines;Respiratory,Safety requirements for anesthetic workstations and vaporizers.
ISO_80601-2-72,Medical electrical equipment — Part 2-72: Particular requirements for home-care ventilators,ISO 80601-2-72:2015,Global,Ventilators;Home Health,Safety for devices intended for use in non-professional settings.
IEC_60601-1-3,Radiation protection in diagnostic X-ray equipment,IEC 60601-1-3:2008,Global,X-Ray Systems;Cath Labs;Imaging,Requirements for filtration and stray radiation shielding.
ASTM_F2096,Detecting Gross Leaks in Packaging by Internal Pressurization (Bubble Test),ASTM F2096-11,US,Packaging;Inspection;Sterile Barrier,PQ method for whole-pouch leak detection in water baths.
ASTM_F1140,Standard Test Methods for Internal Pressurization Failure Resistance,ASTM F1140-13,US,Packaging;Burst Testers;Assembly,Measures the failure point of unrestrained medical packages.
ASTM_F2054,Burst Testing of Flexible Seals Using Internal Air Pressurization,ASTM F2054-13,US,Packaging;Burst Testers;Sealing,PQ test for seal strength using restraining plates.
ASTM_F2095,Pressure Decay Leak Test for Flexible Packages,ASTM F2095-07,US,Packaging;Leak Testers;Assembly,Quantitative non-destructive leak testing for sterile barrier systems.
USP_85,Bacterial Endotoxins Test (LAL),USP <85>,US,Sterilization;Laboratory;HCT/Ps,Critical release testing for pyrogenicity in implants.
CLSI_AUTO16,Next-Generation In Vitro Diagnostic Instrument Interface,CLSI AUTO16-Ed1,US;Global,IVD Production;Software;LIMS,Connectivity and data exchange standards for lab analyzers.
ISO_11737-3,Microbiological methods — Part 3: Guidance on evaluation and use of bioburden data,ISO 11737-3:2023,Global,Sterilization;Bioburden;Validation,Guidance for interpreting microbial data in PQ stability. 
ISO_14644-7,"Separative devices (clean air hoods, gloveboxes, isolators and mini-environments)",ISO 14644-7:2004,Global,Isolators;Gloveboxes;HCT/Ps,Qualification requirements for physical barrier systems.
