standard_id,title,short_citation,region,applies_to,notes
ISO_15883-4,Washer-disinfectors for chemical disinfection of heat-sensitive endoscopes,ISO 15883-4:2018,Global,Cleaning;Endoscope Reprocessors,Specific validation requirements for AERs (Automated Reprocessors).
ISO_11608-2,Needle-based injection systems — Part 2: Double-ended needles,ISO 11608-2:2022,Global,Needles;Pen Injectors;Assembly,Particular requirements for pen-injector interfaces.
ISO_11608-3,Needle-based injection systems — Part 3: Containers and integrated fluid paths,ISO 11608-3:2022,Global,Filling;Cartridges;Dosing,Safety for pre-filled drug cartridges in automated injectors.
ASTM_F2026,Standard Specification for Polyetheretherketone (PEEK) Polymers for Surgical Implant Applications,ASTM F2026-17,US,PEEK;Machining;Material Forming,Primary material specification for PEEK used in spinal fusion cages.
ASTM_F648,Standard Specification for Ultra-High-Molecular-Weight Polyethylene for Surgical Implants,ASTM F648-21,US,UHMWPE;Machining;Forming,Establishes limits for orthopedic bearing surfaces (acetabular liners).
ISO_5832-1,Implants for surgery — Metallic materials — Part 1: Wrought stainless steel,ISO 5832-1:2016,Global,Orthopedics;Machining;Material Prep,Standard chemistry and tensile requirements for 316L implantable steel.
ISO_5832-2,Implants for surgery — Metallic materials — Part 2: Unalloyed titanium,ISO 5832-2:2018,Global,Orthopedics;Machining;Material Forming,Specification for Commercially Pure (CP) titanium grades 1-4.
ISO_5832-3,Implants for surgery — Metallic materials — Part 3: Wrought Ti 6-Al 4-V alloy,ISO 5832-3:2021,Global,Orthopedics;Machining;Nitinol,The primary alloy for joint replacements and dental implants.
ASTM_F2082,Standard Test Method for Determination of Transformation Temperature of Nitinol by BFR,ASTM F2082-15,US,Nitinol;Material Forming;Metrology,"The industry-standard ""Bend and Free Recovery"" method for verifying Af."
ASTM_F2063,Standard Specification for Wrought Nickel-Titanium Shape Memory Alloys for Medical Devices,ASTM F2063-24,US,Nitinol;Material Forming;Design,"Establishes purity, chemistry, and transformation temp tolerances. "
ASTM_F2516,Standard Test Method for Tension Testing of Nickel-Titanium Superelastic Materials,ASTM F2516-22,US,Nitinol;Material Forming;Lab,Defines the loading/unloading plateau measurements for stents. 
ISO_14644-3,Cleanrooms and associated controlled environments — Part 3: Test methods,ISO 14644-3:2019,Global,Facilities;HVAC;Metrology,Includes recovery tests to verify how quickly rooms return to class. 
ISO_14644-8,Cleanrooms — Part 8: Assessment of air cleanliness by chemical concentration (ACC),ISO_14644-8:2022,Global,Facilities;Utilities;HCT/Ps,Critical for qualifying environments sensitive to volatile organics.
ISO_14644-9,Cleanrooms — Part 9: Classification of surface cleanliness by particle concentration,ISO_14644-9:2022,Global,Facilities;Inspection;Metrology,Standard for validating post-wash cleanliness levels of device parts.
ISO_14644-10,Cleanrooms — Part 10: Classification of surface cleanliness by chemical concentration,ISO_14644-10:2022,Global,Facilities;Cleaning;Metrology,Used to validate residual removal (TOC/NVR) on device surfaces.
ISO_14708-3,Active implantable medical devices — Part 3: Implantable neurostimulators,ISO 14708-3:2017,Global,Active Implants;Neurostimulators,Safety/performance for deep brain and spinal cord stimulators.
ISO_14708-4,Active implantable medical devices — Part 4: Implantable infusion pumps,ISO 14708-4:2022,Global,Active Implants;Infusion Pumps,Particular requirements for internal automated drug delivery.
ISO_14708-6,Active implantable medical devices — Part 6: Hearing impairment devices,ISO 14708-6:2019,Global,Active Implants;Cochlear Implants,Standards for qualifying internal hearing assist electronics.
ISO_14708-7,Active implantable medical devices — Part 7: Implantable parts,ISO 14708-7:2019,Global,Active Implants;Leads;Connectors,Specific benchmarks for patient-contact leads and headers.
ISO_11138-4,Sterilization — Biological indicators — Part 4: Indicators for dry heat,ISO 11138-4:2017,Global,Sterilization;Ovens;BIs,Specific requirements for B. atrophaeus challenge carriers.
ISO_11138-5,Sterilization — Biological indicators — Part 5: Indicators for formaldehyde,ISO 11138-5:2017,Global,Sterilization;BIs;Chemical,Benchmarks for indicators used in low-temp vapor processes.
AAMI_TIR35,Sterilization — Radiation — Product adoption and alternative sampling plans,AAMI TIR35:2016,US,Sterilization;Gamma;E-Beam,Guidance for qualifying new products into a validated dose. 
AAMI_TIR40,Sterilization — Radiation — Guidance on dose setting utilizing Method 2,AAMI TIR40:2018,US,Sterilization;Gamma;E-Beam,Statistical methodology for low-bioburden medical parts. 
ISO_13408-7,Aseptic processing of health care products — Part 7: Alternative processes for medical devices and combination products,ISO 13408-7:2012,Global,Robotic Aseptic Filling;Isolators;IVD Production,Essential for qualifying non-traditional aseptic assembly lines.
USP_711,Physical Tests — Dissolution,USP <711>,US,Dissolution Systems;Analytical Lab;Combination Products,Core benchmark for qualifying drug-release rates of eluting devices.
USP_921,Chemical Tests — Water Determination,USP <921>,US,Karl Fischer Titrators;Analytical Lab;HCT/Ps,Standards for moisture analysis in lyophilized biological tissues.
USP_643,Chemical Tests — Total Organic Carbon,USP <643>,US,TOC Analyzers;Utilities;WFI Systems,Defines limits for organic impurities in pharmaceutical-grade water.
ISO_14644-14,Cleanrooms — Part 14: Assessment of suitability for use of equipment by airborne particle concentration,ISO 14644-14:2016,Global,Cleanroom AGVs;Robotics;Conveyors,Mandatory for qualifying automated transport systems in classified areas.
ISO_11138-1,Sterilization of health care products — Biological indicators — Part 1: General requirements,ISO 11138-1:2017,Global,BIs;Sterilization;Incubators,Foundational requirements for challenge organisms used in PQ.
ISO_11138-2,Sterilization of health care products — Biological indicators — Part 2: Indicators for ethylene oxide,ISO 11138-2:2017,Global,EtO Chambers;Sterilization;Laboratory,Particular requirements for B. atrophaeus challenge carriers.
ISO_11138-3,Sterilization of health care products — Biological indicators — Part 3: Indicators for moist heat,ISO 11138-3:2017,Global,Autoclaves;Sterilization;Incubators,Particular requirements for G. stearothermophilus carriers.
ISO_11138-7,"Sterilization — Biological indicators — Part 7: Guidance for the selection, use and interpretation of results",ISO 11138-7:2019,Global,Sterilization;Validation;Challenge,Replaces ISO 14161; critical for justifying 3-run PQ strategies. 
ISO_11138-8,Sterilization — Biological indicators — Part 8: Method for validation of a reduced incubation time,ISO 11138-8:2021,Global,Sterilization;Incubators;Release,Standard for justifying shorter quarantine periods for sterile lots. 
ISO_18472,Sterilization — Biological and chemical indicators — Test equipment,ISO 18472:2018,Global,Resistometers;Metrology;Lab,Requirements for the chambers used to characterize indicator D-values. 
ISO_15883-4,Washer-disinfectors for chemical disinfection of heat-sensitive endoscopes,ISO 15883-4:2018,Global,AERs;Endoscope Reprocessors;Cleaning,Performance benchmarks for automated endoscope reprocessing units.
AAMI_ST91,Flexible and semi-rigid endoscope processing in health care facilities,AAMI ST91:2021,US,Endoscopes;Cleaning;Reprocessing,Comprehensive US guidelines for HLD and sterile storage.
AAMI_ST108,Water for the processing of medical devices,AAMI ST108:2023,US,Utilities;Cleaning;Reprocessing,Defines water quality for device rinsing and surgical tool finishing.
IEC_62353,Medical electrical equipment — Recurrent test and test after repair,IEC 62353:2014,Global,Active Devices;Safety Safety Safety safety analyzers;Metrology,Protocols for validating grounding paths and leakage on the floor.
ASTM_F2101,Evaluating the Bacterial Filtration Efficiency (BFE) of Medical Face Mask Materials,ASTM F2101-25,US,PPE;Masks;Laundering,Uses biological aerosols to qualify respiratory barrier levels.
ASTM_F1670,Resistance of Materials Used in Protective Clothing to Penetration by Synthetic Blood,ASTM F1670-24a,US,PPE;Gowns;Cleanroom Suits,Mandatory test for qualifying surgical drapes and aseptic gear.
ASTM_F2407,Standard Specification for Surgical Gowns Intended for Use in Healthcare Facilities,ASTM F2407-23a,US,PPE;Surgical Gowns;Forming,Performance levels for barriers based on liquid penetration risk.
ASTM_F3502,Standard Specification for Barrier Face Coverings,ASTM F3502-25,US,PPE;Masks;Environment,Requirements for non-medical masks used by production personnel.
ISO_11608-2,Needle-based injection systems for medical use — Part 2: Double-ended needles,ISO 11608-2:2022,Global,Pen Injectors;Needles;Therapeutic,Performance requirements for the automated needle-to-pen interface.
CLSI_EP05,Evaluation of Precision of Quantitative Measurement Procedures,CLSI EP05-A3,US;Global,IVD Production;Laboratory;Analyzers,Foundational for establishing within-site precision for diagnostic assays. 
CLSI_EP06,Evaluation of Linearity of Quantitative Measurement Procedures,CLSI EP06-Ed2,US;Global,IVD Production;Laboratory;Analyzers,Guidance for validating the analytical measuring interval (AMI). 
CLSI_EP07,Interference Testing in Clinical Chemistry,CLSI EP07-Ed3,US;Global,IVD Production;Laboratory;Reagents,Evaluates the effect of substances like lipids or drugs on test results. 
CLSI_EP17,Evaluation of Detection Capability for Clinical Laboratory Procedures,CLSI EP17-Ed2,US;Global,IVD Production;Laboratory;Reagents,"Standard for defining Limit of Blank (LoB), Detection (LoD), and Quantitation (LoQ). "
CLSI_EP09,Measurement Procedure Comparison and Bias Estimation Using Patient Samples,CLSI EP09-A3,US;Global,IVD Production;Laboratory;Analyzers,Required for verifying bias when changing instruments or reagent lots. 
CLSI_EP12,"Evaluation of Qualitative, Binary Output Examination Performance",CLSI EP12-A2,US;Global,IVD Production;Laboratory;LFA,"Methodology for validating ""Yes/No"" qualitative assays. "
USP_232,Elemental Impurities — Limits,USP ,US,Biocomp;Materials;Analytical Lab,Sets PDE limits for toxic elements in medical components.
USP_233,Elemental Impurities — Procedures,USP ,US,Biocomp;Materials;Analytical Lab,Defines validation requirements for ICP-MS and ICP-OES procedures.
ICH_Q3D,Guideline for Elemental Impurities,ICH Q3D(R2),Global,Biocomp;Risk Management;Materials,Harmonized global framework for controlling elemental contamination risk. 
USP_858,Raman Spectroscopy,USP ,US,Metrology;Raw Material ID;Lab,Requirements for wavelength accuracy and linearity in Raman systems.
USP_1858,Raman Spectroscopy — Theory and Practice,USP ,US,Metrology;Raw Material ID;Lab,Informational guidance on scattering theory and chemometric models.
ASTM_F3127,Validating Cleaning Processes Used During Manufacture of Medical Devices,ASTM F3127-16,US,Cleaning;Washer-Disinfectors;Reprocessing,Provides a lifecycle approach to medical cleaning validation. 
IPC_A_600,Acceptability of Printed Boards,IPC-A-600K,Global,Electronics;PCBs;Active Implants,Visual and structural acceptance standards for bare medical circuit boards.
IPC_7530,Guidelines for Temperature Profiling for Mass Soldering Processes,IPC-7530A,Global,Electronics;Reflow Ovens;Assembly,Methodology for establishing baseline profiles in SMT reflow ovens.
ASTM_F3320,Coating Characterization of Drug Coated Balloons,ASTM F3320-18,US,Cardiovascular;Coating;Balloons,Benchmark for validating drug load and particulate release consistency.
ISO_21474-2,IVD medical devices — Multiplex molecular testing — Part 2: Validation,ISO 21474-2:2022,Global,IVD Production;Molecular Testing,Requirements for simultaneous detection of multiple nucleic acid targets.
IEC_81001-5-1,Health software and health IT systems — Part 5-1: Security,IEC 81001-5-1:2021,Global,Software;Cybersecurity;IT Systems,First international standard for secure software development life cycles.
IEC_82304-1,Health software — Part 1: General requirements for product safety,IEC 82304-1:2016,Global,Software;Mobile Apps;Cloud Systems,Safety and validation requirements for standalone medical software (SaMD).
ASTM_E2859,Size Measurement of Nanoparticles Using Atomic Force Microscopy,ASTM E2859-11,US,Metrology;Nanotechnology;Implants,Used to qualify nano-scale surface features on osseointegrated implants.
21_CFR_892_2050,Medical image management and processing system (MIMPS),21 CFR 892.2050,US,Radiology;Imaging Systems;Software,"FDA regulation for software used to store, transfer, and display images."
ISO_15004-1,Ophthalmic instruments — Fundamental requirements and test methods — Part 1: General requirements,ISO 15004-1:2020,Global,Ophthalmic;Design;Test Equipment,"Core requirements for design, performance, and environmental conditions."
ISO_15004-2,Ophthalmic instruments — Fundamental requirements and test methods — Part 2: Light hazard protection,ISO 15004-2:2024,Global,Ophthalmic;Lasers;Safety,Benchmarks for optical radiation safety to prevent retinal damage.
ISO_80601-2-74,Medical electrical equipment — Part 2-74: Particular requirements for respiratory humidifying equipment,ISO 80601-2-74:2021,Global,Humidifiers;Ventilators;Respiratory,Safety/performance for humidifiers in invasive and non-invasive use.
ISO_21530,Dentistry — Materials used for dental equipment surfaces — Determination of resistance to chemical disinfectants,ISO 21530:2004,Global,Dental;Cleaning;Metrology,PQ method for validating surface durability against repeated cleaning.
ASTM_F2847,Standard Practice for Reporting and Assessment of Residues on Single-Use Implants,ASTM F2847-17,US,Implants;Cleaning;Forming,Protocol for qualifying surface cleanliness and manufacturing residuals.
ISO_22442-1,Medical devices utilizing animal tissues — Part 1: Application of risk management,ISO 22442-1:2020,Global,HCT/Ps;Biological Implants;Design,Risk framework for pathogens in animal-derived device components. 
ISO_22442-2,"Medical devices utilizing animal tissues — Part 2: Controls on sourcing, collection and handling",ISO 22442-2:2020,Global,HCT/Ps;Biological Implants;Sourcing,Mandatory requirements for the animal-origin supply chain. 
ISO_22442-3,Medical devices utilizing animal tissues — Part 3: Validation of virus/TSE inactivation,ISO 22442-3:2007,Global,HCT/Ps;Biological Implants;Sterilization,Validation criteria for eliminating infectious agents from tissue. 
ASTM_F2100,Standard Specification for Performance of Materials Used in Medical Face Masks,ASTM F2100-23,US,PPE;Masks;Laundering,Establishes the Level 1-3 barrier hierarchy for medical settings.
IEC_60601-2-40,Particular requirements for basic safety and essential performance of electromyographs,IEC 60601-2-40:2024,Global,EMG;Evoked Response;Neurology,Safety requirements for muscle and nerve monitoring equipment.
ISO_19223-2,Lung ventilators and related equipment — Vocabulary — Part 2: High frequency and jet ventilation,ISO 19223-2:2025,Global,Ventilators;Respiratory;Design,Standardized terminology for neonatal and critical care jet systems.
ISO_19223-3,Lung ventilators and related equipment — Vocabulary — Part 3: Respiratory care,ISO 19223-3:2025,Global,Ventilators;Respiratory;Design,General terminology framework for the respiratory therapy sector.
ISO_10993-2,Biological evaluation of medical devices — Part 2: Animal welfare requirements,ISO 10993-2:2022,Global,Biocompatibility;All;Laboratory,Ethical and scientific requirements for any necessary animal testing. 
ISO_TR_10993-33,Biological evaluation — Part 33: Guidance on tests to evaluate genotoxicity,ISO/TR 10993-33:2015,Global,Biocompatibility;All;Laboratory,Supplemental report for interpreting complex genotoxicity data. 
ASTM_F748,Standard Practice for Selecting Generic Biological Test Methods for Materials and Devices,ASTM F748-25,US,Biocompatibility;All;Laboratory,US framework for selecting biocomp tests commensurate with risk.
ASTM_F1984,Standard Practice for Testing for Whole Complement Activation in Serum,ASTM F1984-25,US,Biocompatibility;Implants;Materials,Evaluates the inflammatory response to solid device materials.
ASTM_F895,Agar Diffusion Cell Culture Screening for Cytotoxicity,ASTM F895-25,US,Biocompatibility;All;Laboratory,Standard method for qualifying the cytotoxicity of extractables.
ISO_11138-4,Sterilization — Biological indicators — Part 4: Indicators for dry heat,ISO 11138-4:2017,Global,Sterilization;Ovens;BIs,Specific requirements for B. atrophaeus challenge carriers.
ISO_11138-5,Sterilization — Biological indicators — Part 5: Indicators for formaldehyde,ISO 11138-5:2017,Global,Sterilization;BIs;Chemical,Benchmarks for low-temperature steam and formaldehyde indicators.
ISO_374-5,Protective gloves against dangerous chemicals and micro-organisms,ISO 374-5:2016,Global,PPE;Gloves;Forming,Core standard for validating the viral protection of medical gloves.
ISO_5840-1,Cardiovascular implants — Cardiac valve prostheses — Part 1: General requirements,ISO 5840-1:2021,Global,Heart Valves;Cardiovascular,Core safety and performance requirements for cardiac valve substitutes.
ISO_5840-2,Cardiovascular implants — Cardiac valve prostheses — Part 2: Surgically implanted heart valve substitutes,ISO 5840-2:2021,Global,Heart Valves;Surgical Implants,Performance benchmarks for valves implanted via traditional surgery.
ISO_5840-3,Cardiovascular implants — Cardiac valve prostheses — Part 3: Heart valve substitutes implanted by transcatheter techniques,ISO 5840-3:2021,Global,TAVI;TAVR;Interventional Cardiology,Specific benchmarks for minimally invasive heart valve replacements.
ISO_7206-4,Implants for surgery — Partial and total hip joint prostheses — Part 4: Determination of endurance properties of stemmed femoral components,ISO 7206-4:2010,Global,Hip Implants;Orthopedics;Fatigue Rigs,"PQ test method for stemmed components under physiological cyclic load. [6, 7]"
ISO_7206-6,Implants for surgery — Partial and total hip joint prostheses — Part 6: Determination of endurance properties of head and neck region of stemmed femoral components,ISO 7206-6:2013,Global,Hip Implants;Orthopedics;Mechanical Testing,Particular requirements for the femoral head-neck taper junction. [7]
ISO_7206-10,Implants for surgery — Partial and total hip joint prostheses — Part 10: Determination of resistance to static load of modular femoral heads,ISO 7206-10:2018,Global,Hip Implants;Modular Joints;Metrology,Static crush testing to qualify ceramic/metallic modular heads.
ASTM_F1875,Standard Practice for Fretting Corrosion Testing of Modular Implant Interfaces: Hip Femoral Head-Bore and Cone Taper Interface,ASTM F1875-98,US,Hip Implants;Orthopedics;Metrology,PQ method for assessing material loss at modular implant junctions. [7]
ASTM_F2009,Standard Test Method for Determining the Axial Disassembly Force of Taper Connections of Modular Prostheses,ASTM F2009-20,US,Orthopedic Implants;Modular Joints;Force Gauges,Mechanical benchmark for validating modular joint locking stability.
ISO_14242-1,Implants for surgery — Wear of total hip-joint prostheses — Part 1: Loading and displacement parameters for wear-testing machines and corresponding environmental conditions for test,ISO 14242-1:2014,Global,Hip Implants;Wear Simulators;Orthopedics,Defines the standardized gait cycle for qualifying joint bearing surfaces.
ISO_14242-2,Implants for surgery — Wear of total hip-joint prostheses — Part 2: Methods of measurement,ISO 14242-2:2016,Global,Hip Implants;Metrology;Lab,"Gravimetric measurement protocols for assessing total mass loss. [6, 7]"
ISO_14243-1,Implants for surgery — Wear of total knee-joint prostheses — Part 1: Loading and displacement parameters for wear-testing machines with load control and corresponding environmental conditions for test,ISO 14243-1:2009,Global,Knee Implants;Wear Simulators;Orthopedics,Simulation parameters for load-controlled knee joint simulators.
ISO_14243-2,Implants for surgery — Wear of total knee-joint prostheses — Part 2: Methods of measurement,ISO 14243-2:2016,Global,Knee Implants;Metrology;Lab,Gravimetric protocols for assessing tibial insert wear debris. [7]
ISO_21535,Non-active surgical implants — Joint replacement implants — Specific requirements for hip-joint replacement implants,ISO 21535:2023,Global,Hip Implants;Orthopedics;Design,Core requirements for marking and performance of hip systems. [8]
ISO_21536,Non-active surgical implants — Joint replacement implants — Specific requirements for knee-joint replacement implants,ISO 21536:2023,Global,Knee Implants;Orthopedics;Design,Core performance and safety benchmarks for all total knee systems. [8]
ASTM_F1264,Standard Specification and Test Methods for Intramedullary Fixation Devices,ASTM F1264-16,US,Orthopedic Trauma;Trauma Fixation;Machining,Governs the mechanical testing of orthopedic nails and rods. [7]
ASTM_F1717,Standard Test Methods for Spinal Implant Constructs in a Vertebrectomy Model,ASTM F1717-21,US,Orthopedics;Spinal Implants;Fatigue Rigs,Primary fatigue rig protocol for qualifying spinal fixation hardware. [9]
ASTM_F1798,Standard Guide for Evaluating the Static and Fatigue Properties of Interconnection Mechanisms and Subassemblies Used in Spinal Arthrodesis Implants,ASTM F1798-13,US,Spinal Implants;Fatigue Rigs;Assembly,"Validation method for spinal clamps, plugs, and cross-links."
ASTM_F2193,Standard Specifications and Test Methods for Components Used in the Surgical Fixation of the Spinal Skeletal System,ASTM F2193-20,US,Spinal Implants;Machining;Forming,Performance benchmarks for spinal thin wires and cables. [9]
ISO_14801,Dentistry — Implants — Dynamic loading test for endosseous dental implants,ISO 14801:2016,Global,Dental Implants;Metrology;Fatigue Rigs,Defines the flexural fatigue challenge for qualifying dental screws. [9]
ISO_11070,"Sterile single-use intravascular introducers, dilators and guidewires",ISO 11070:2014,Global,Catheters;Guidewires;Introducers,Technical requirements for vascular access device safety.
ISO_14117,Active implantable medical devices — Electromagnetic compatibility — EMC test protocols,ISO 14117:2019,Global,Active Implants;Lab;Product Testing,Protocols for qualifying pacer/defib immunity to EMI and magnetic fields. [Image 1]
ISO_IEEE_11073_10101,Health informatics — Personal health device communication — Part 10101: Nomenclature,ISO/IEEE 11073-10101,Global,Software;Patient Monitoring;Active Implants,Vital sign communication standards for interoperable clinical data devices. [Image 1]
ISO_TR_22979,Ophthalmic implants — Intraocular Lenses — Guidance on clinical investigation of modifications,ISO/TR 22979:2017,Global,IOLs;Ophthalmics;Clinical,Guidance for risk management of modified anterior/posterior chamber lenses. [; S_R450]
USP_232,Elemental Impurities — Limits,USP ,US,Biocomp;Materials;Analytical Lab,Sets Permitted Daily Exposure (PDE) limits for toxic elements in medical components.
USP_233,Elemental Impurities — Procedures,USP ,US,Biocomp;Materials;Analytical Lab,Defines validation requirements for ICP-MS and ICP-OES safety release procedures.
USP_858,Raman Spectroscopy,USP ,US,Metrology;Raw Material ID;Lab,Outlines requirements for wavelength accuracy and linearity in Raman systems.
USP_1858,Raman Spectroscopy — Theory and Practice,USP ,US,Metrology;Raw Material ID;Lab,Informational guidance on scattering theory and chemometric release models.
USP_1225,Validation of Compendial Procedures,USP ,US,Analytical Lab;Metrology,"Requirements for proving analytical methods are accurate, precise, and specific."
ASTM_F3127,Standard Guide for Validating Cleaning Processes Used During Medical Device Manufacture,ASTM F3127-16,US,Cleaning;Washer-Disinfectors;Reprocessing,Provides a structured lifecycle approach to medical equipment cleaning validation.
ISO_12189,Implants for surgery — Mechanical testing of spinal devices — Fatigue method with anterior support,ISO 12189:2008,Global,Spinal Implants;Fatigue Rigs;Mechanical Testing,Standardized fatigue testing on flexible spinal assemblies mimicking gait.
ASTM_F2706,Test Methods for Occipital-Cervical Spinal Implant Constructs in a Vertebrectomy Model,ASTM F2706-18,US,Spinal Implants;Fatigue Rigs;Mechanical Testing,Evaluates static and dynamic properties of high-risk cervical spinal hardware.
ASTM_F2624,"Test Method for Static, Dynamic, and Wear Assessment of Extra-Discal Spinal Constructs",ASTM F2624-12,US,Spinal Implants;Wear Simulators;Mechanical Testing,Evaluates mechanical integrity and wear debris of single-level disc constructs.
ASTM_F1223,Standard Test Method for Determination of Total Knee Replacement Constraint,ASTM F1223-20,US,Knee Implants;Mechanical Testing,Measures the stability and constraint of knee bearing surfaces under stress.
ASTM_F3334,Practice for FEA of Metallic Orthopaedic Total Knee Tibial Components,ASTM F3334-19,US,Knee Implants;FEA;Design,Computational modeling guidelines for knee component safety validation.
ASTM_F2033,Standard Specification for Metal-on-Metal Hip Arthroplasty Bearings,ASTM F2033-20,US,Hip Implants;Metrology;Surface Finish,Defines surface finish and tolerances for bearing surfaces to minimize wear.
ASTM_F2582,Test Method for Dynamic Impingement Between Femoral and Acetabular Hip Components,ASTM F2582-20,US,Hip Implants;Mechanical Testing,Evaluates the risk of component contact outside the intended bearing area.
